
*** Running vivado
    with args -log tx_top.vdi -applog -m64 -product Vivado -messageDb vivado.pb -mode batch -source tx_top.tcl -notrace


****** Vivado v2022.1 (64-bit)
  **** SW Build 3526262 on Mon Apr 18 15:47:01 MDT 2022
  **** IP Build 3524634 on Mon Apr 18 20:55:01 MDT 2022
    ** Copyright 1986-2022 Xilinx, Inc. All Rights Reserved.

source tx_top.tcl -notrace
Command: link_design -top tx_top -part xc7a35tcpg236-1
Design is defaulting to srcset: sources_1
Design is defaulting to constrset: constrs_1
INFO: [Device 21-403] Loading part xc7a35tcpg236-1
INFO: [Project 1-454] Reading design checkpoint '/home/plwalker/AMT_SQUAD/frame_sync/pn11_tx/pn11_tx.gen/sources_1/ip/clk_wiz_1/clk_wiz_1.dcp' for cell 'nolabel_line33'
Netlist sorting complete. Time (s): cpu = 00:00:00 ; elapsed = 00:00:00 . Memory (MB): peak = 2903.082 ; gain = 0.000 ; free physical = 1429 ; free virtual = 4447
INFO: [Netlist 29-17] Analyzing 4 Unisim elements for replacement
INFO: [Netlist 29-28] Unisim Transformation completed in 0 CPU seconds
INFO: [Project 1-479] Netlist was created with Vivado 2022.1
INFO: [Project 1-570] Preparing netlist for logic optimization
Parsing XDC File [/home/plwalker/AMT_SQUAD/frame_sync/pn11_tx/pn11_tx.gen/sources_1/ip/clk_wiz_1/clk_wiz_1_board.xdc] for cell 'nolabel_line33/inst'
Finished Parsing XDC File [/home/plwalker/AMT_SQUAD/frame_sync/pn11_tx/pn11_tx.gen/sources_1/ip/clk_wiz_1/clk_wiz_1_board.xdc] for cell 'nolabel_line33/inst'
Parsing XDC File [/home/plwalker/AMT_SQUAD/frame_sync/pn11_tx/pn11_tx.gen/sources_1/ip/clk_wiz_1/clk_wiz_1.xdc] for cell 'nolabel_line33/inst'
INFO: [Timing 38-35] Done setting XDC timing constraints. [/home/plwalker/AMT_SQUAD/frame_sync/pn11_tx/pn11_tx.gen/sources_1/ip/clk_wiz_1/clk_wiz_1.xdc:57]
INFO: [Timing 38-2] Deriving generated clocks [/home/plwalker/AMT_SQUAD/frame_sync/pn11_tx/pn11_tx.gen/sources_1/ip/clk_wiz_1/clk_wiz_1.xdc:57]
get_clocks: Time (s): cpu = 00:00:06 ; elapsed = 00:00:06 . Memory (MB): peak = 3023.141 ; gain = 64.031 ; free physical = 951 ; free virtual = 3965
Finished Parsing XDC File [/home/plwalker/AMT_SQUAD/frame_sync/pn11_tx/pn11_tx.gen/sources_1/ip/clk_wiz_1/clk_wiz_1.xdc] for cell 'nolabel_line33/inst'
Parsing XDC File [/home/plwalker/AMT_SQUAD/frame_sync/pn11_tx/pn11_tx.ip_user_files/220_constraints.xdc]
WARNING: [Constraints 18-619] A clock with name 'clk' already exists, overwriting the previous clock with the same name. [/home/plwalker/AMT_SQUAD/frame_sync/pn11_tx/pn11_tx.ip_user_files/220_constraints.xdc:15]
Finished Parsing XDC File [/home/plwalker/AMT_SQUAD/frame_sync/pn11_tx/pn11_tx.ip_user_files/220_constraints.xdc]
INFO: [Opt 31-138] Pushed 0 inverter(s) to 0 load pin(s).
Netlist sorting complete. Time (s): cpu = 00:00:00 ; elapsed = 00:00:00 . Memory (MB): peak = 3023.141 ; gain = 0.000 ; free physical = 946 ; free virtual = 3960
INFO: [Project 1-111] Unisim Transformation Summary:
No Unisim elements were transformed.

10 Infos, 1 Warnings, 0 Critical Warnings and 0 Errors encountered.
link_design completed successfully
link_design: Time (s): cpu = 00:00:10 ; elapsed = 00:00:11 . Memory (MB): peak = 3023.141 ; gain = 120.059 ; free physical = 946 ; free virtual = 3960
Command: opt_design
Attempting to get a license for feature 'Implementation' and/or device 'xc7a35t'
INFO: [Common 17-349] Got license for feature 'Implementation' and/or device 'xc7a35t'
Running DRC as a precondition to command opt_design

Starting DRC Task
INFO: [DRC 23-27] Running DRC with 8 threads
INFO: [Project 1-461] DRC finished with 0 Errors
INFO: [Project 1-462] Please refer to the DRC report (report_drc) for more information.

Time (s): cpu = 00:00:01 ; elapsed = 00:00:00.94 . Memory (MB): peak = 3087.172 ; gain = 64.031 ; free physical = 940 ; free virtual = 3955

Starting Cache Timing Information Task
INFO: [Timing 38-35] Done setting XDC timing constraints.
Ending Cache Timing Information Task | Checksum: 16749a9e0

Time (s): cpu = 00:00:00.01 ; elapsed = 00:00:00.01 . Memory (MB): peak = 3087.172 ; gain = 0.000 ; free physical = 940 ; free virtual = 3955

Starting Logic Optimization Task

Phase 1 Retarget
INFO: [Opt 31-138] Pushed 0 inverter(s) to 0 load pin(s).
In IDDR TRANSFORM
INFO: [Opt 31-49] Retargeted 0 cell(s).
Phase 1 Retarget | Checksum: 16749a9e0

Time (s): cpu = 00:00:00.03 ; elapsed = 00:00:00.06 . Memory (MB): peak = 3255.297 ; gain = 0.000 ; free physical = 686 ; free virtual = 3701
INFO: [Opt 31-389] Phase Retarget created 0 cells and removed 0 cells
INFO: [Opt 31-1021] In phase Retarget, 1 netlist objects are constrained preventing optimization. Please run opt_design with -debug_log to get more detail. 

Phase 2 Constant propagation
INFO: [Opt 31-138] Pushed 0 inverter(s) to 0 load pin(s).
Phase 2 Constant propagation | Checksum: 16749a9e0

Time (s): cpu = 00:00:00.03 ; elapsed = 00:00:00.07 . Memory (MB): peak = 3255.297 ; gain = 0.000 ; free physical = 686 ; free virtual = 3701
INFO: [Opt 31-389] Phase Constant propagation created 0 cells and removed 0 cells

Phase 3 Sweep
Phase 3 Sweep | Checksum: 1b9fb3c52

Time (s): cpu = 00:00:00.04 ; elapsed = 00:00:00.07 . Memory (MB): peak = 3255.297 ; gain = 0.000 ; free physical = 686 ; free virtual = 3701
INFO: [Opt 31-389] Phase Sweep created 0 cells and removed 0 cells

Phase 4 BUFG optimization
Phase 4 BUFG optimization | Checksum: 1b9fb3c52

Time (s): cpu = 00:00:00.05 ; elapsed = 00:00:00.09 . Memory (MB): peak = 3255.297 ; gain = 0.000 ; free physical = 686 ; free virtual = 3701
INFO: [Opt 31-662] Phase BUFG optimization created 0 cells of which 0 are BUFGs and removed 0 cells.

Phase 5 Shift Register Optimization
INFO: [Opt 31-1064] SRL Remap converted 0 SRLs to 0 registers and converted 0 registers of register chains to 0 SRLs
Phase 5 Shift Register Optimization | Checksum: 1b9fb3c52

Time (s): cpu = 00:00:00.05 ; elapsed = 00:00:00.09 . Memory (MB): peak = 3255.297 ; gain = 0.000 ; free physical = 686 ; free virtual = 3701
INFO: [Opt 31-389] Phase Shift Register Optimization created 0 cells and removed 0 cells

Phase 6 Post Processing Netlist
Phase 6 Post Processing Netlist | Checksum: 1b9fb3c52

Time (s): cpu = 00:00:00.05 ; elapsed = 00:00:00.1 . Memory (MB): peak = 3255.297 ; gain = 0.000 ; free physical = 686 ; free virtual = 3701
INFO: [Opt 31-389] Phase Post Processing Netlist created 0 cells and removed 0 cells
Opt_design Change Summary
=========================


-------------------------------------------------------------------------------------------------------------------------
|  Phase                        |  #Cells created  |  #Cells Removed  |  #Constrained objects preventing optimizations  |
-------------------------------------------------------------------------------------------------------------------------
|  Retarget                     |               0  |               0  |                                              1  |
|  Constant propagation         |               0  |               0  |                                              0  |
|  Sweep                        |               0  |               0  |                                              0  |
|  BUFG optimization            |               0  |               0  |                                              0  |
|  Shift Register Optimization  |               0  |               0  |                                              0  |
|  Post Processing Netlist      |               0  |               0  |                                              0  |
-------------------------------------------------------------------------------------------------------------------------



Starting Connectivity Check Task

Time (s): cpu = 00:00:00 ; elapsed = 00:00:00 . Memory (MB): peak = 3255.297 ; gain = 0.000 ; free physical = 686 ; free virtual = 3701
Ending Logic Optimization Task | Checksum: cd2508e6

Time (s): cpu = 00:00:00.06 ; elapsed = 00:00:00.1 . Memory (MB): peak = 3255.297 ; gain = 0.000 ; free physical = 686 ; free virtual = 3701

Starting Power Optimization Task
INFO: [Pwropt 34-132] Skipping clock gating for clocks with a period < 2.00 ns.
Ending Power Optimization Task | Checksum: cd2508e6

Time (s): cpu = 00:00:00.01 ; elapsed = 00:00:00.03 . Memory (MB): peak = 3255.297 ; gain = 0.000 ; free physical = 685 ; free virtual = 3700

Starting Final Cleanup Task
Ending Final Cleanup Task | Checksum: cd2508e6

Time (s): cpu = 00:00:00 ; elapsed = 00:00:00 . Memory (MB): peak = 3255.297 ; gain = 0.000 ; free physical = 685 ; free virtual = 3700

Starting Netlist Obfuscation Task
Netlist sorting complete. Time (s): cpu = 00:00:00 ; elapsed = 00:00:00 . Memory (MB): peak = 3255.297 ; gain = 0.000 ; free physical = 685 ; free virtual = 3700
Ending Netlist Obfuscation Task | Checksum: cd2508e6

Time (s): cpu = 00:00:00 ; elapsed = 00:00:00 . Memory (MB): peak = 3255.297 ; gain = 0.000 ; free physical = 685 ; free virtual = 3700
INFO: [Common 17-83] Releasing license: Implementation
28 Infos, 1 Warnings, 0 Critical Warnings and 0 Errors encountered.
opt_design completed successfully
INFO: [Timing 38-480] Writing timing data to binary archive.
Writing XDEF routing.
Writing XDEF routing logical nets.
Writing XDEF routing special nets.
Write XDEF Complete: Time (s): cpu = 00:00:00.05 ; elapsed = 00:00:00.02 . Memory (MB): peak = 3279.309 ; gain = 16.008 ; free physical = 683 ; free virtual = 3698
INFO: [Common 17-1381] The checkpoint '/home/plwalker/AMT_SQUAD/frame_sync/pn11_tx/pn11_tx.runs/impl_1/tx_top_opt.dcp' has been generated.
INFO: [runtcl-4] Executing : report_drc -file tx_top_drc_opted.rpt -pb tx_top_drc_opted.pb -rpx tx_top_drc_opted.rpx
Command: report_drc -file tx_top_drc_opted.rpt -pb tx_top_drc_opted.pb -rpx tx_top_drc_opted.rpx
INFO: [IP_Flow 19-1839] IP Catalog is up to date.
INFO: [Timing 38-35] Done setting XDC timing constraints.
INFO: [DRC 23-27] Running DRC with 8 threads
INFO: [Vivado_Tcl 2-168] The results of DRC are in file /home/plwalker/AMT_SQUAD/frame_sync/pn11_tx/pn11_tx.runs/impl_1/tx_top_drc_opted.rpt.
report_drc completed successfully
Command: place_design
Attempting to get a license for feature 'Implementation' and/or device 'xc7a35t'
INFO: [Common 17-349] Got license for feature 'Implementation' and/or device 'xc7a35t'
INFO: [DRC 23-27] Running DRC with 8 threads
INFO: [Vivado_Tcl 4-198] DRC finished with 0 Errors
INFO: [Vivado_Tcl 4-199] Please refer to the DRC report (report_drc) for more information.
Running DRC as a precondition to command place_design
INFO: [DRC 23-27] Running DRC with 8 threads
INFO: [Vivado_Tcl 4-198] DRC finished with 0 Errors
INFO: [Vivado_Tcl 4-199] Please refer to the DRC report (report_drc) for more information.

Starting Placer Task
INFO: [Place 30-611] Multithreading enabled for place_design using a maximum of 8 CPUs

Phase 1 Placer Initialization

Phase 1.1 Placer Initialization Netlist Sorting
Netlist sorting complete. Time (s): cpu = 00:00:00 ; elapsed = 00:00:00 . Memory (MB): peak = 3365.820 ; gain = 0.000 ; free physical = 617 ; free virtual = 3635
Phase 1.1 Placer Initialization Netlist Sorting | Checksum: ae89b369

Time (s): cpu = 00:00:00.01 ; elapsed = 00:00:00.09 . Memory (MB): peak = 3365.820 ; gain = 0.000 ; free physical = 617 ; free virtual = 3635
Netlist sorting complete. Time (s): cpu = 00:00:00 ; elapsed = 00:00:00 . Memory (MB): peak = 3365.820 ; gain = 0.000 ; free physical = 617 ; free virtual = 3635

Phase 1.2 IO Placement/ Clock Placement/ Build Placer Device
Phase 1.2 IO Placement/ Clock Placement/ Build Placer Device | Checksum: 1b52b18a4

Time (s): cpu = 00:00:00.53 ; elapsed = 00:00:00.5 . Memory (MB): peak = 3365.820 ; gain = 0.000 ; free physical = 639 ; free virtual = 3662

Phase 1.3 Build Placer Netlist Model
Phase 1.3 Build Placer Netlist Model | Checksum: 225c47ca7

Time (s): cpu = 00:00:01 ; elapsed = 00:00:00.75 . Memory (MB): peak = 3365.820 ; gain = 0.000 ; free physical = 658 ; free virtual = 3683

Phase 1.4 Constrain Clocks/Macros
Phase 1.4 Constrain Clocks/Macros | Checksum: 225c47ca7

Time (s): cpu = 00:00:01 ; elapsed = 00:00:00.76 . Memory (MB): peak = 3365.820 ; gain = 0.000 ; free physical = 658 ; free virtual = 3683
Phase 1 Placer Initialization | Checksum: 225c47ca7

Time (s): cpu = 00:00:01 ; elapsed = 00:00:00.78 . Memory (MB): peak = 3365.820 ; gain = 0.000 ; free physical = 658 ; free virtual = 3683

Phase 2 Global Placement

Phase 2.1 Floorplanning
Phase 2.1 Floorplanning | Checksum: 251951c0a

Time (s): cpu = 00:00:02 ; elapsed = 00:00:00.96 . Memory (MB): peak = 3365.820 ; gain = 0.000 ; free physical = 656 ; free virtual = 3682

Phase 2.2 Update Timing before SLR Path Opt
Phase 2.2 Update Timing before SLR Path Opt | Checksum: 2151c89a0

Time (s): cpu = 00:00:02 ; elapsed = 00:00:00.97 . Memory (MB): peak = 3365.820 ; gain = 0.000 ; free physical = 656 ; free virtual = 3682

Phase 2.3 Post-Processing in Floorplanning
Phase 2.3 Post-Processing in Floorplanning | Checksum: 2151c89a0

Time (s): cpu = 00:00:02 ; elapsed = 00:00:00.97 . Memory (MB): peak = 3365.820 ; gain = 0.000 ; free physical = 656 ; free virtual = 3682

Phase 2.4 Global Placement Core

Phase 2.4.1 Physical Synthesis In Placer
INFO: [Physopt 32-1044] Break lutnm for timing: one critical 0, two critical 0, total 0, new lutff created 0
INFO: [Physopt 32-1138] End 1 Pass. Optimized 0 net or LUT. Breaked 0 LUT, combined 0 existing LUT and moved 0 existing LUT
INFO: [Physopt 32-65] No nets found for high-fanout optimization.
INFO: [Physopt 32-232] Optimized 0 net. Created 0 new instance.
INFO: [Physopt 32-775] End 1 Pass. Optimized 0 net or cell. Created 0 new cell, deleted 0 existing cell and moved 0 existing cell
INFO: [Physopt 32-670] No setup violation found.  DSP Register Optimization was not performed.
INFO: [Physopt 32-670] No setup violation found.  Shift Register to Pipeline Optimization was not performed.
INFO: [Physopt 32-670] No setup violation found.  Shift Register Optimization was not performed.
INFO: [Physopt 32-670] No setup violation found.  BRAM Register Optimization was not performed.
INFO: [Physopt 32-670] No setup violation found.  URAM Register Optimization was not performed.
INFO: [Physopt 32-949] No candidate nets found for dynamic/static region interface net replication
INFO: [Physopt 32-775] End 1 Pass. Optimized 0 net or cell. Created 0 new cell, deleted 0 existing cell and moved 0 existing cell
Netlist sorting complete. Time (s): cpu = 00:00:00 ; elapsed = 00:00:00 . Memory (MB): peak = 3365.820 ; gain = 0.000 ; free physical = 633 ; free virtual = 3663

Summary of Physical Synthesis Optimizations
============================================


-----------------------------------------------------------------------------------------------------------------------------------------------------------
|  Optimization                                     |  Added Cells  |  Removed Cells  |  Optimized Cells/Nets  |  Dont Touch  |  Iterations  |  Elapsed   |
-----------------------------------------------------------------------------------------------------------------------------------------------------------
|  LUT Combining                                    |            0  |              0  |                     0  |           0  |           1  |  00:00:00  |
|  Retime                                           |            0  |              0  |                     0  |           0  |           1  |  00:00:00  |
|  Very High Fanout                                 |            0  |              0  |                     0  |           0  |           1  |  00:00:00  |
|  DSP Register                                     |            0  |              0  |                     0  |           0  |           0  |  00:00:00  |
|  Shift Register to Pipeline                       |            0  |              0  |                     0  |           0  |           0  |  00:00:00  |
|  Shift Register                                   |            0  |              0  |                     0  |           0  |           0  |  00:00:00  |
|  BRAM Register                                    |            0  |              0  |                     0  |           0  |           0  |  00:00:00  |
|  URAM Register                                    |            0  |              0  |                     0  |           0  |           0  |  00:00:00  |
|  Dynamic/Static Region Interface Net Replication  |            0  |              0  |                     0  |           0  |           1  |  00:00:00  |
|  Total                                            |            0  |              0  |                     0  |           0  |           4  |  00:00:00  |
-----------------------------------------------------------------------------------------------------------------------------------------------------------


Phase 2.4.1 Physical Synthesis In Placer | Checksum: 1f8cbbfe4

Time (s): cpu = 00:00:03 ; elapsed = 00:00:02 . Memory (MB): peak = 3365.820 ; gain = 0.000 ; free physical = 633 ; free virtual = 3663
Phase 2.4 Global Placement Core | Checksum: 21d5a7210

Time (s): cpu = 00:00:04 ; elapsed = 00:00:02 . Memory (MB): peak = 3365.820 ; gain = 0.000 ; free physical = 634 ; free virtual = 3664
Phase 2 Global Placement | Checksum: 21d5a7210

Time (s): cpu = 00:00:04 ; elapsed = 00:00:02 . Memory (MB): peak = 3365.820 ; gain = 0.000 ; free physical = 634 ; free virtual = 3664

Phase 3 Detail Placement

Phase 3.1 Commit Multi Column Macros
Phase 3.1 Commit Multi Column Macros | Checksum: 2906d47ef

Time (s): cpu = 00:00:04 ; elapsed = 00:00:02 . Memory (MB): peak = 3365.820 ; gain = 0.000 ; free physical = 634 ; free virtual = 3664

Phase 3.2 Commit Most Macros & LUTRAMs
Phase 3.2 Commit Most Macros & LUTRAMs | Checksum: 1e75748f6

Time (s): cpu = 00:00:04 ; elapsed = 00:00:02 . Memory (MB): peak = 3365.820 ; gain = 0.000 ; free physical = 634 ; free virtual = 3664

Phase 3.3 Area Swap Optimization
Phase 3.3 Area Swap Optimization | Checksum: 1dd5f499a

Time (s): cpu = 00:00:04 ; elapsed = 00:00:02 . Memory (MB): peak = 3365.820 ; gain = 0.000 ; free physical = 634 ; free virtual = 3664

Phase 3.4 Pipeline Register Optimization
Phase 3.4 Pipeline Register Optimization | Checksum: 1e89231e0

Time (s): cpu = 00:00:04 ; elapsed = 00:00:02 . Memory (MB): peak = 3365.820 ; gain = 0.000 ; free physical = 634 ; free virtual = 3664

Phase 3.5 Small Shape Detail Placement
Phase 3.5 Small Shape Detail Placement | Checksum: 12d37b87f

Time (s): cpu = 00:00:04 ; elapsed = 00:00:02 . Memory (MB): peak = 3365.820 ; gain = 0.000 ; free physical = 633 ; free virtual = 3664

Phase 3.6 Re-assign LUT pins
Phase 3.6 Re-assign LUT pins | Checksum: 17e913507

Time (s): cpu = 00:00:04 ; elapsed = 00:00:02 . Memory (MB): peak = 3365.820 ; gain = 0.000 ; free physical = 633 ; free virtual = 3664

Phase 3.7 Pipeline Register Optimization
Phase 3.7 Pipeline Register Optimization | Checksum: 1af7e6543

Time (s): cpu = 00:00:04 ; elapsed = 00:00:02 . Memory (MB): peak = 3365.820 ; gain = 0.000 ; free physical = 633 ; free virtual = 3664
Phase 3 Detail Placement | Checksum: 1af7e6543

Time (s): cpu = 00:00:04 ; elapsed = 00:00:02 . Memory (MB): peak = 3365.820 ; gain = 0.000 ; free physical = 633 ; free virtual = 3664

Phase 4 Post Placement Optimization and Clean-Up

Phase 4.1 Post Commit Optimization
INFO: [Timing 38-35] Done setting XDC timing constraints.

Phase 4.1.1 Post Placement Optimization
Post Placement Optimization Initialization | Checksum: 12918a814

Phase 4.1.1.1 BUFG Insertion

Starting Physical Synthesis Task

Phase 1 Physical Synthesis Initialization
INFO: [Physopt 32-721] Multithreading enabled for phys_opt_design using a maximum of 8 CPUs
INFO: [Physopt 32-619] Estimated Timing Summary | WNS=91.819 | TNS=0.000 |
Phase 1 Physical Synthesis Initialization | Checksum: ec77a22d

Time (s): cpu = 00:00:00.09 ; elapsed = 00:00:00.03 . Memory (MB): peak = 3365.820 ; gain = 0.000 ; free physical = 632 ; free virtual = 3663
INFO: [Place 46-56] BUFG insertion identified 0 candidate nets. Inserted BUFG: 0, Replicated BUFG Driver: 0, Skipped due to Placement/Routing Conflicts: 0, Skipped due to Timing Degradation: 0, Skipped due to Illegal Netlist: 0.
Ending Physical Synthesis Task | Checksum: b8b30750

Time (s): cpu = 00:00:00.09 ; elapsed = 00:00:00.03 . Memory (MB): peak = 3365.820 ; gain = 0.000 ; free physical = 632 ; free virtual = 3663
Phase 4.1.1.1 BUFG Insertion | Checksum: 12918a814

Time (s): cpu = 00:00:05 ; elapsed = 00:00:02 . Memory (MB): peak = 3365.820 ; gain = 0.000 ; free physical = 632 ; free virtual = 3663

Phase 4.1.1.2 Post Placement Timing Optimization
INFO: [Place 30-746] Post Placement Timing Summary WNS=91.819. For the most accurate timing information please run report_timing.
Phase 4.1.1.2 Post Placement Timing Optimization | Checksum: da970eeb

Time (s): cpu = 00:00:05 ; elapsed = 00:00:02 . Memory (MB): peak = 3365.820 ; gain = 0.000 ; free physical = 632 ; free virtual = 3663

Time (s): cpu = 00:00:05 ; elapsed = 00:00:02 . Memory (MB): peak = 3365.820 ; gain = 0.000 ; free physical = 632 ; free virtual = 3663
Phase 4.1 Post Commit Optimization | Checksum: da970eeb

Time (s): cpu = 00:00:05 ; elapsed = 00:00:02 . Memory (MB): peak = 3365.820 ; gain = 0.000 ; free physical = 632 ; free virtual = 3663

Phase 4.2 Post Placement Cleanup
Phase 4.2 Post Placement Cleanup | Checksum: da970eeb

Time (s): cpu = 00:00:05 ; elapsed = 00:00:02 . Memory (MB): peak = 3365.820 ; gain = 0.000 ; free physical = 632 ; free virtual = 3663

Phase 4.3 Placer Reporting

Phase 4.3.1 Print Estimated Congestion
INFO: [Place 30-612] Post-Placement Estimated Congestion 
 ____________________________________________________
|           | Global Congestion | Short Congestion  |
| Direction | Region Size       | Region Size       |
|___________|___________________|___________________|
|      North|                1x1|                1x1|
|___________|___________________|___________________|
|      South|                1x1|                1x1|
|___________|___________________|___________________|
|       East|                1x1|                1x1|
|___________|___________________|___________________|
|       West|                1x1|                1x1|
|___________|___________________|___________________|

Phase 4.3.1 Print Estimated Congestion | Checksum: da970eeb

Time (s): cpu = 00:00:05 ; elapsed = 00:00:02 . Memory (MB): peak = 3365.820 ; gain = 0.000 ; free physical = 632 ; free virtual = 3663
Phase 4.3 Placer Reporting | Checksum: da970eeb

Time (s): cpu = 00:00:05 ; elapsed = 00:00:02 . Memory (MB): peak = 3365.820 ; gain = 0.000 ; free physical = 632 ; free virtual = 3663

Phase 4.4 Final Placement Cleanup
Netlist sorting complete. Time (s): cpu = 00:00:00 ; elapsed = 00:00:00 . Memory (MB): peak = 3365.820 ; gain = 0.000 ; free physical = 632 ; free virtual = 3663

Time (s): cpu = 00:00:05 ; elapsed = 00:00:02 . Memory (MB): peak = 3365.820 ; gain = 0.000 ; free physical = 632 ; free virtual = 3663
Phase 4 Post Placement Optimization and Clean-Up | Checksum: 16fa565f3

Time (s): cpu = 00:00:05 ; elapsed = 00:00:02 . Memory (MB): peak = 3365.820 ; gain = 0.000 ; free physical = 632 ; free virtual = 3663
Ending Placer Task | Checksum: 12f2608db

Time (s): cpu = 00:00:05 ; elapsed = 00:00:02 . Memory (MB): peak = 3365.820 ; gain = 0.000 ; free physical = 632 ; free virtual = 3663
INFO: [Common 17-83] Releasing license: Implementation
62 Infos, 1 Warnings, 0 Critical Warnings and 0 Errors encountered.
place_design completed successfully
INFO: [Timing 38-480] Writing timing data to binary archive.
Writing XDEF routing.
Writing XDEF routing logical nets.
Writing XDEF routing special nets.
Write XDEF Complete: Time (s): cpu = 00:00:00.06 ; elapsed = 00:00:00.02 . Memory (MB): peak = 3365.820 ; gain = 0.000 ; free physical = 645 ; free virtual = 3676
INFO: [Common 17-1381] The checkpoint '/home/plwalker/AMT_SQUAD/frame_sync/pn11_tx/pn11_tx.runs/impl_1/tx_top_placed.dcp' has been generated.
INFO: [runtcl-4] Executing : report_io -file tx_top_io_placed.rpt
report_io: Time (s): cpu = 00:00:00.09 ; elapsed = 00:00:00.14 . Memory (MB): peak = 3365.820 ; gain = 0.000 ; free physical = 637 ; free virtual = 3668
INFO: [runtcl-4] Executing : report_utilization -file tx_top_utilization_placed.rpt -pb tx_top_utilization_placed.pb
INFO: [runtcl-4] Executing : report_control_sets -verbose -file tx_top_control_sets_placed.rpt
report_control_sets: Time (s): cpu = 00:00:00.05 ; elapsed = 00:00:00.1 . Memory (MB): peak = 3365.820 ; gain = 0.000 ; free physical = 641 ; free virtual = 3673
Command: phys_opt_design
Attempting to get a license for feature 'Implementation' and/or device 'xc7a35t'
INFO: [Common 17-349] Got license for feature 'Implementation' and/or device 'xc7a35t'
INFO: [Vivado_Tcl 4-383] Design worst setup slack (WNS) is greater than or equal to 0.000 ns. Skipping all physical synthesis optimizations.
INFO: [Vivado_Tcl 4-232] No setup violation found. The netlist was not modified.
INFO: [Common 17-83] Releasing license: Implementation
71 Infos, 1 Warnings, 0 Critical Warnings and 0 Errors encountered.
phys_opt_design completed successfully
INFO: [Timing 38-480] Writing timing data to binary archive.
Writing XDEF routing.
Writing XDEF routing logical nets.
Writing XDEF routing special nets.
Write XDEF Complete: Time (s): cpu = 00:00:00.04 ; elapsed = 00:00:00.02 . Memory (MB): peak = 3365.820 ; gain = 0.000 ; free physical = 618 ; free virtual = 3650
INFO: [Common 17-1381] The checkpoint '/home/plwalker/AMT_SQUAD/frame_sync/pn11_tx/pn11_tx.runs/impl_1/tx_top_physopt.dcp' has been generated.
Command: route_design
Attempting to get a license for feature 'Implementation' and/or device 'xc7a35t'
INFO: [Common 17-349] Got license for feature 'Implementation' and/or device 'xc7a35t'
Running DRC as a precondition to command route_design
INFO: [DRC 23-27] Running DRC with 8 threads
INFO: [Vivado_Tcl 4-198] DRC finished with 0 Errors
INFO: [Vivado_Tcl 4-199] Please refer to the DRC report (report_drc) for more information.


Starting Routing Task
INFO: [Route 35-254] Multithreading enabled for route_design using a maximum of 8 CPUs

Phase 1 Build RT Design
Checksum: PlaceDB: 5b3c5b64 ConstDB: 0 ShapeSum: d3e9ad77 RouteDB: 0
Post Restoration Checksum: NetGraph: 1012e419 NumContArr: fb4494a2 Constraints: 0 Timing: 0
Phase 1 Build RT Design | Checksum: 10b5778bb

Time (s): cpu = 00:00:16 ; elapsed = 00:00:14 . Memory (MB): peak = 3390.445 ; gain = 23.688 ; free physical = 494 ; free virtual = 3559

Phase 2 Router Initialization

Phase 2.1 Fix Topology Constraints
Phase 2.1 Fix Topology Constraints | Checksum: 10b5778bb

Time (s): cpu = 00:00:16 ; elapsed = 00:00:15 . Memory (MB): peak = 3412.441 ; gain = 45.684 ; free physical = 461 ; free virtual = 3529

Phase 2.2 Pre Route Cleanup
Phase 2.2 Pre Route Cleanup | Checksum: 10b5778bb

Time (s): cpu = 00:00:16 ; elapsed = 00:00:15 . Memory (MB): peak = 3412.441 ; gain = 45.684 ; free physical = 461 ; free virtual = 3529
 Number of Nodes with overlaps = 0

Phase 2.3 Update Timing
Phase 2.3 Update Timing | Checksum: 13a65051f

Time (s): cpu = 00:00:16 ; elapsed = 00:00:15 . Memory (MB): peak = 3422.441 ; gain = 55.684 ; free physical = 447 ; free virtual = 3519
INFO: [Route 35-416] Intermediate Timing Summary | WNS=91.865 | TNS=0.000  | WHS=-0.076 | THS=-1.514 |


Router Utilization Summary
  Global Vertical Routing Utilization    = 0 %
  Global Horizontal Routing Utilization  = 0 %
  Routable Net Status*
  *Does not include unroutable nets such as driverless and loadless.
  Run report_route_status for detailed report.
  Number of Failed Nets               = 83
    (Failed Nets is the sum of unrouted and partially routed nets)
  Number of Unrouted Nets             = 83
  Number of Partially Routed Nets     = 0
  Number of Node Overlaps             = 0

Phase 2 Router Initialization | Checksum: 19e667ab6

Time (s): cpu = 00:00:16 ; elapsed = 00:00:15 . Memory (MB): peak = 3426.441 ; gain = 59.684 ; free physical = 446 ; free virtual = 3518

Phase 3 Initial Routing

Phase 3.1 Global Routing
Phase 3.1 Global Routing | Checksum: 19e667ab6

Time (s): cpu = 00:00:16 ; elapsed = 00:00:15 . Memory (MB): peak = 3426.441 ; gain = 59.684 ; free physical = 446 ; free virtual = 3518
Phase 3 Initial Routing | Checksum: 1659f255f

Time (s): cpu = 00:00:17 ; elapsed = 00:00:16 . Memory (MB): peak = 3426.441 ; gain = 59.684 ; free physical = 449 ; free virtual = 3515

Phase 4 Rip-up And Reroute

Phase 4.1 Global Iteration 0
 Number of Nodes with overlaps = 3
 Number of Nodes with overlaps = 0
INFO: [Route 35-416] Intermediate Timing Summary | WNS=91.291 | TNS=0.000  | WHS=N/A    | THS=N/A    |

Phase 4.1 Global Iteration 0 | Checksum: 1c2b89a35

Time (s): cpu = 00:00:17 ; elapsed = 00:00:16 . Memory (MB): peak = 3426.441 ; gain = 59.684 ; free physical = 448 ; free virtual = 3515

Phase 4.2 Global Iteration 1
 Number of Nodes with overlaps = 0
INFO: [Route 35-416] Intermediate Timing Summary | WNS=91.291 | TNS=0.000  | WHS=N/A    | THS=N/A    |

Phase 4.2 Global Iteration 1 | Checksum: c12b6ea9

Time (s): cpu = 00:00:17 ; elapsed = 00:00:16 . Memory (MB): peak = 3426.441 ; gain = 59.684 ; free physical = 448 ; free virtual = 3515
Phase 4 Rip-up And Reroute | Checksum: c12b6ea9

Time (s): cpu = 00:00:17 ; elapsed = 00:00:16 . Memory (MB): peak = 3426.441 ; gain = 59.684 ; free physical = 448 ; free virtual = 3515

Phase 5 Delay and Skew Optimization

Phase 5.1 Delay CleanUp
Phase 5.1 Delay CleanUp | Checksum: c12b6ea9

Time (s): cpu = 00:00:17 ; elapsed = 00:00:16 . Memory (MB): peak = 3426.441 ; gain = 59.684 ; free physical = 448 ; free virtual = 3515

Phase 5.2 Clock Skew Optimization
Phase 5.2 Clock Skew Optimization | Checksum: c12b6ea9

Time (s): cpu = 00:00:17 ; elapsed = 00:00:16 . Memory (MB): peak = 3426.441 ; gain = 59.684 ; free physical = 448 ; free virtual = 3515
Phase 5 Delay and Skew Optimization | Checksum: c12b6ea9

Time (s): cpu = 00:00:17 ; elapsed = 00:00:16 . Memory (MB): peak = 3426.441 ; gain = 59.684 ; free physical = 448 ; free virtual = 3515

Phase 6 Post Hold Fix

Phase 6.1 Hold Fix Iter

Phase 6.1.1 Update Timing
Phase 6.1.1 Update Timing | Checksum: 765ce25d

Time (s): cpu = 00:00:17 ; elapsed = 00:00:16 . Memory (MB): peak = 3426.441 ; gain = 59.684 ; free physical = 448 ; free virtual = 3515
INFO: [Route 35-416] Intermediate Timing Summary | WNS=91.370 | TNS=0.000  | WHS=0.170  | THS=0.000  |

Phase 6.1 Hold Fix Iter | Checksum: d1467414

Time (s): cpu = 00:00:17 ; elapsed = 00:00:16 . Memory (MB): peak = 3426.441 ; gain = 59.684 ; free physical = 448 ; free virtual = 3515
Phase 6 Post Hold Fix | Checksum: d1467414

Time (s): cpu = 00:00:17 ; elapsed = 00:00:16 . Memory (MB): peak = 3426.441 ; gain = 59.684 ; free physical = 448 ; free virtual = 3515

Phase 7 Route finalize

Router Utilization Summary
  Global Vertical Routing Utilization    = 0.0143506 %
  Global Horizontal Routing Utilization  = 0.0192608 %
  Routable Net Status*
  *Does not include unroutable nets such as driverless and loadless.
  Run report_route_status for detailed report.
  Number of Failed Nets               = 0
    (Failed Nets is the sum of unrouted and partially routed nets)
  Number of Unrouted Nets             = 0
  Number of Partially Routed Nets     = 0
  Number of Node Overlaps             = 0

Phase 7 Route finalize | Checksum: 78f1925d

Time (s): cpu = 00:00:17 ; elapsed = 00:00:16 . Memory (MB): peak = 3426.441 ; gain = 59.684 ; free physical = 448 ; free virtual = 3515

Phase 8 Verifying routed nets

 Verification completed successfully
Phase 8 Verifying routed nets | Checksum: 78f1925d

Time (s): cpu = 00:00:17 ; elapsed = 00:00:16 . Memory (MB): peak = 3426.441 ; gain = 59.684 ; free physical = 446 ; free virtual = 3512

Phase 9 Depositing Routes
Phase 9 Depositing Routes | Checksum: a4035e4b

Time (s): cpu = 00:00:17 ; elapsed = 00:00:16 . Memory (MB): peak = 3442.449 ; gain = 75.691 ; free physical = 446 ; free virtual = 3512

Phase 10 Post Router Timing
INFO: [Route 35-57] Estimated Timing Summary | WNS=91.370 | TNS=0.000  | WHS=0.170  | THS=0.000  |

INFO: [Route 35-327] The final timing numbers are based on the router estimated timing analysis. For a complete and accurate timing signoff, please run report_timing_summary.
Phase 10 Post Router Timing | Checksum: a4035e4b

Time (s): cpu = 00:00:17 ; elapsed = 00:00:16 . Memory (MB): peak = 3442.449 ; gain = 75.691 ; free physical = 446 ; free virtual = 3512
INFO: [Route 35-16] Router Completed Successfully

Time (s): cpu = 00:00:17 ; elapsed = 00:00:16 . Memory (MB): peak = 3442.449 ; gain = 75.691 ; free physical = 479 ; free virtual = 3545

Routing Is Done.
INFO: [Common 17-83] Releasing license: Implementation
86 Infos, 1 Warnings, 0 Critical Warnings and 0 Errors encountered.
route_design completed successfully
route_design: Time (s): cpu = 00:00:18 ; elapsed = 00:00:16 . Memory (MB): peak = 3442.449 ; gain = 76.629 ; free physical = 479 ; free virtual = 3545
INFO: [Timing 38-480] Writing timing data to binary archive.
Writing XDEF routing.
Writing XDEF routing logical nets.
Writing XDEF routing special nets.
Write XDEF Complete: Time (s): cpu = 00:00:00.06 ; elapsed = 00:00:00.02 . Memory (MB): peak = 3442.449 ; gain = 0.000 ; free physical = 475 ; free virtual = 3542
INFO: [Common 17-1381] The checkpoint '/home/plwalker/AMT_SQUAD/frame_sync/pn11_tx/pn11_tx.runs/impl_1/tx_top_routed.dcp' has been generated.
INFO: [runtcl-4] Executing : report_drc -file tx_top_drc_routed.rpt -pb tx_top_drc_routed.pb -rpx tx_top_drc_routed.rpx
Command: report_drc -file tx_top_drc_routed.rpt -pb tx_top_drc_routed.pb -rpx tx_top_drc_routed.rpx
INFO: [IP_Flow 19-1839] IP Catalog is up to date.
INFO: [DRC 23-27] Running DRC with 8 threads
INFO: [Vivado_Tcl 2-168] The results of DRC are in file /home/plwalker/AMT_SQUAD/frame_sync/pn11_tx/pn11_tx.runs/impl_1/tx_top_drc_routed.rpt.
report_drc completed successfully
INFO: [runtcl-4] Executing : report_methodology -file tx_top_methodology_drc_routed.rpt -pb tx_top_methodology_drc_routed.pb -rpx tx_top_methodology_drc_routed.rpx
Command: report_methodology -file tx_top_methodology_drc_routed.rpt -pb tx_top_methodology_drc_routed.pb -rpx tx_top_methodology_drc_routed.rpx
INFO: [Timing 38-35] Done setting XDC timing constraints.
INFO: [DRC 23-133] Running Methodology with 8 threads
INFO: [Vivado_Tcl 2-1520] The results of Report Methodology are in file /home/plwalker/AMT_SQUAD/frame_sync/pn11_tx/pn11_tx.runs/impl_1/tx_top_methodology_drc_routed.rpt.
report_methodology completed successfully
INFO: [runtcl-4] Executing : report_power -file tx_top_power_routed.rpt -pb tx_top_power_summary_routed.pb -rpx tx_top_power_routed.rpx
Command: report_power -file tx_top_power_routed.rpt -pb tx_top_power_summary_routed.pb -rpx tx_top_power_routed.rpx
INFO: [Timing 38-35] Done setting XDC timing constraints.
Running Vector-less Activity Propagation...

Finished Running Vector-less Activity Propagation
98 Infos, 1 Warnings, 0 Critical Warnings and 0 Errors encountered.
report_power completed successfully
INFO: [runtcl-4] Executing : report_route_status -file tx_top_route_status.rpt -pb tx_top_route_status.pb
INFO: [runtcl-4] Executing : report_timing_summary -max_paths 10 -report_unconstrained -file tx_top_timing_summary_routed.rpt -pb tx_top_timing_summary_routed.pb -rpx tx_top_timing_summary_routed.rpx -warn_on_violation 
INFO: [Timing 38-91] UpdateTimingParams: Speed grade: -1, Delay Type: min_max.
INFO: [Timing 38-191] Multithreading enabled for timing update using a maximum of 8 CPUs
INFO: [runtcl-4] Executing : report_incremental_reuse -file tx_top_incremental_reuse_routed.rpt
INFO: [Vivado_Tcl 4-1062] Incremental flow is disabled. No incremental reuse Info to report.
INFO: [runtcl-4] Executing : report_clock_utilization -file tx_top_clock_utilization_routed.rpt
INFO: [runtcl-4] Executing : report_bus_skew -warn_on_violation -file tx_top_bus_skew_routed.rpt -pb tx_top_bus_skew_routed.pb -rpx tx_top_bus_skew_routed.rpx
INFO: [Timing 38-91] UpdateTimingParams: Speed grade: -1, Delay Type: min_max.
INFO: [Timing 38-191] Multithreading enabled for timing update using a maximum of 8 CPUs
INFO: [Common 17-206] Exiting Vivado at Mon Jul 18 12:34:18 2022...

*** Running vivado
    with args -log tx_top.vdi -applog -m64 -product Vivado -messageDb vivado.pb -mode batch -source tx_top.tcl -notrace


****** Vivado v2022.1 (64-bit)
  **** SW Build 3526262 on Mon Apr 18 15:47:01 MDT 2022
  **** IP Build 3524634 on Mon Apr 18 20:55:01 MDT 2022
    ** Copyright 1986-2022 Xilinx, Inc. All Rights Reserved.

source tx_top.tcl -notrace
Command: open_checkpoint tx_top_routed.dcp
INFO: [Device 21-403] Loading part xc7a35tcpg236-1
Netlist sorting complete. Time (s): cpu = 00:00:00 ; elapsed = 00:00:00.01 . Memory (MB): peak = 2907.051 ; gain = 0.000 ; free physical = 1357 ; free virtual = 4428
INFO: [Netlist 29-17] Analyzing 4 Unisim elements for replacement
INFO: [Netlist 29-28] Unisim Transformation completed in 0 CPU seconds
INFO: [Project 1-479] Netlist was created with Vivado 2022.1
INFO: [Project 1-570] Preparing netlist for logic optimization
INFO: [Timing 38-478] Restoring timing data from binary archive.
INFO: [Timing 38-479] Binary timing data restore complete.
INFO: [Project 1-856] Restoring constraints from binary archive.
INFO: [Project 1-853] Binary constraint restore complete.
Reading XDEF placement.
Reading placer database...
Reading XDEF routing.
Read XDEF Files: Time (s): cpu = 00:00:00.05 ; elapsed = 00:00:00.06 . Memory (MB): peak = 2971.082 ; gain = 0.000 ; free physical = 859 ; free virtual = 3929
Restored from archive | CPU: 0.060000 secs | Memory: 1.280205 MB |
Finished XDEF File Restore: Time (s): cpu = 00:00:00.05 ; elapsed = 00:00:00.06 . Memory (MB): peak = 2971.082 ; gain = 0.000 ; free physical = 859 ; free virtual = 3929
Netlist sorting complete. Time (s): cpu = 00:00:00 ; elapsed = 00:00:00 . Memory (MB): peak = 2971.082 ; gain = 0.000 ; free physical = 859 ; free virtual = 3929
INFO: [Project 1-111] Unisim Transformation Summary:
No Unisim elements were transformed.

INFO: [Project 1-604] Checkpoint was created with Vivado v2022.1 (64-bit) build 3526262
open_checkpoint: Time (s): cpu = 00:00:14 ; elapsed = 00:00:14 . Memory (MB): peak = 2971.082 ; gain = 72.961 ; free physical = 859 ; free virtual = 3929
Command: write_bitstream -force tx_top.bit
Attempting to get a license for feature 'Implementation' and/or device 'xc7a35t'
INFO: [Common 17-349] Got license for feature 'Implementation' and/or device 'xc7a35t'
Running DRC as a precondition to command write_bitstream
INFO: [IP_Flow 19-234] Refreshing IP repositories
INFO: [IP_Flow 19-1704] No user IP repositories specified
INFO: [IP_Flow 19-2313] Loaded Vivado IP repository '/tools/Xilinx/Vivado/2022.1/data/ip'.
INFO: [DRC 23-27] Running DRC with 8 threads
INFO: [Vivado 12-3199] DRC finished with 0 Errors
INFO: [Vivado 12-3200] Please refer to the DRC report (report_drc) for more information.
INFO: [Designutils 20-2272] Running write_bitstream with 8 threads.
Loading data files...
Loading site data...
Loading route data...
Processing options...
Creating bitmap...
Creating bitstream...
Writing bitstream ./tx_top.bit...
INFO: [Vivado 12-1842] Bitgen Completed Successfully.
INFO: [Project 1-1876] WebTalk data collection is mandatory when using a ULT device. To see the specific WebTalk data collected for your design, open the usage_statistics_webtalk.html or usage_statistics_webtalk.xml file in the implementation directory.
INFO: [Common 17-83] Releasing license: Implementation
22 Infos, 0 Warnings, 0 Critical Warnings and 0 Errors encountered.
write_bitstream completed successfully
write_bitstream: Time (s): cpu = 00:00:08 ; elapsed = 00:00:10 . Memory (MB): peak = 3341.250 ; gain = 370.168 ; free physical = 798 ; free virtual = 3874
INFO: [Common 17-206] Exiting Vivado at Mon Jul 18 12:34:59 2022...
